final_pareto_solutions_rf.csv

algorithm,k_features,accuracy,baseline_accuracy,accuracy_loss,accuracy_change_pct,within_tolerance,f1,fpr,precision,recall,inference_time_sec,inference_time_ms,training_time_sec,is_pareto
NSGA-II,1,0.10239699201002664,0.9410621964593452,0.8386652044493186,-89.11899846840248,False,0.18465917176604527,0.9991628880362748,0.10172467858262778,0.9996918335901387,0.012864007666394173,12.864007666394173,0.4413178809991223,True
NSGA-II,4,0.9009556634811218,0.9410621964593452,0.04010653297822342,-4.2618365852034374,False,0.07274860662951012,0.0013951866062085804,0.7560975609756098,0.03821263482280431,0.013099207666831111,13.099207666831111,0.4567257930002597,True
NSGA-II,10,0.9013316622277926,0.9410621964593452,0.039730534231552594,-4.221881867217157,False,0.12161785216178522,0.00425531914893617,0.6411764705882353,0.06718027734976888,0.024620147333431913,24.620147333431913,0.510443154999848,True
NSGA-II,15,0.9194422685257716,0.9410621964593452,0.02161992793357359,-2.297396284211231,False,0.37490882567469,0.0033833275200558077,0.8882488479262672,0.23759630200308166,0.02475774966690854,24.75774966690854,0.5323758059994361,True
NSGA-II,22,0.9124236252545825,0.9410621964593452,0.028638571204762653,-3.0432176866218286,False,0.31038736738218603,0.0062434600627833976,0.7784653465346535,0.1938366718027735,0.024607909333705418,24.607909333705418,0.578013388000727,True
NSGA-II,26,0.9224815917280276,0.9410621964593452,0.018580604731317618,-1.9744289804887853,False,0.4455401165396683,0.007778165329612835,0.8167625308134757,0.3063174114021572,0.034445929000260854,34.445929000260854,0.5824046549996638,True
NSGA-II,37,0.9289989033369889,0.9410621964593452,0.012063293122356322,-1.2818805353932277,False,0.5300705101617587,0.010429019881409138,0.8103994927076728,0.3938366718027735,0.04056326333314549,40.56326333314549,0.656006938000246,True
SPEA2,1,0.8981043396522012,0.9410621964593452,0.042957856807144035,-4.564826529932748,False,0.0,0.0002441576560865016,0.0,0.0,0.01290432866668804,12.90432866668804,0.4336496369996894,True
SPEA2,3,0.9033996553344822,0.9410621964593452,0.037662541124863,-4.00213091829261,False,0.11178334773840391,0.0011161492849668642,0.8584070796460177,0.05978428351309707,0.01297858200026288,12.97858200026288,0.481966618000115,True
SPEA2,10,0.9172802757324142,0.9410621964593452,0.023781920726930972,-2.5271359126323563,False,0.35984481086323955,0.004778514126264388,0.8441410693970421,0.22865947611710324,0.0234229923332047,23.4229923332047,0.4767605509996429,True
SPEA2,15,0.9189096036346546,0.9410621964593452,0.02215259282469062,-2.3539988013584643,False,0.3763855421686747,0.004325078479246599,0.8629834254143647,0.24067796610169492,0.02430067466654388,24.30067466654388,0.48039630399944144,True
SPEA2,43,0.9237349208835971,0.9410621964593452,0.01732727557574809,-1.841246587201173,False,0.48388464800678543,0.011510289501220789,0.7756628144119646,0.35161787365177194,0.04435700733332245,44.35700733332245,0.7240505290001238,True
SPEA2,59,0.9284662384458718,0.9410621964593452,0.012595958013473352,-1.3384830525404607,False,0.544765702891326,0.014091384722706662,0.7717514124293785,0.4209553158705701,0.054349526333377675,54.349526333377675,0.8489094699998532,True
MOEA/D,1,0.8985116716277612,0.9410621964593452,0.04255052483158395,-4.521542252114276,False,0.003691171947093202,0.0,1.0,0.0018489984591679508,0.012871183666599487,12.871183666599487,0.43364533099975233,True
MOEA/D,13,0.8988563371455428,0.9410621964593452,0.042205859313802385,-4.484917093960188,False,0.05779334500875657,0.00286013254272759,0.5469613259668509,0.030508474576271188,0.023771486666798108,23.771486666798108,0.49771873600002436,True
MOEA/D,35,0.9220429265235782,0.9410621964593452,0.01901926993576697,-2.0210428181394513,False,0.45676855895196505,0.010080223229856994,0.7835205992509363,0.3223420647149461,0.05064859566694698,50.64859566694698,0.7759842340001342,True
MOEA/D,43,0.9252389158702804,0.9410621964593452,0.015823280589064792,-1.6814277152560526,False,0.49831791421362487,0.01137077084059993,0.7842488418266049,0.36517719568567025,0.05474292533350914,54.74292533350914,0.7996361550003712,True
MOEA/D,47,0.9265862447125176,0.9410621964593452,0.014475951746827587,-1.5382566424718733,False,0.5137995434737498,0.011719567492152074,0.7865311308767471,0.38151001540832047,0.05962975833305487,59.62975833305487,0.8104941909996342,True
MOEA/D,48,0.9256149146169512,0.9410621964593452,0.015447281842393967,-1.6414729972697724,False,0.507673164661966,0.012312521799790721,0.7761572606214331,0.37719568567026196,0.053256103999956395,53.256103999956395,0.9250978830004897,True
MODE,60,0.9300328998903337,0.9410621964593452,0.011029296569011526,-1.1720050609309545,False,0.5734479465138491,0.017056156260899895,0.7542713567839195,0.462557781201849,0.05602681666672046,56.02681666672046,0.855895708999924,True
MODE,1836,0.9331662227792574,0.9410621964593452,0.007895973680087764,-0.8390490777119298,True,0.6360689302166865,0.02622950819672131,0.7125382262996942,0.57442218798151,0.10595136999988124,105.95136999988124,14.374802540000019,True

FINAL_RESULTS_RF.md

### Key Finding:

- Full-feature Random Forest baseline achieves **94.11% accuracy** (10,000 features, 99.59 ms inference latency).
- Under strict $\le 0.01$ tolerance ($\ge 93.11\%$), **MODE** produced a valid subset at **$K = 1,836$ features** with **93.32% accuracy** (0.79% accuracy loss).
- Under feature minimization trade-off analysis, **NSGA-II** is the **overall winner**: it discovered an ultra-compact subset of just **37 features** (99.63% dimensionality reduction) that retains **92.90% accuracy** (only 1.21% drop from baseline), slashes inference latency by **2.46x** (down to 40.56 ms), and achieves the highest Hypervolume (**0.5909**).